"ID_ejemplo","ID_area","ID_competencia","Idioma","Texto","Tipo"
1,1,1,"Español","Sabe que algunos de los contenidos en línea que aparecen en los resultados de la búsqueda pueden no ser de acceso libre o gratuito y pueden requerir el pago de una cuota o la suscripción a un servicio para poder acceder a ellos.","Conocimiento"
1,1,1,"Inglés","Knows that some online content in search result may not be open access or freely available and may require a fee or signing up for a service in order to access it.","Knowledge"
2,1,1,"Español","Es consciente de que los contenidos en línea que están a disposición de las personas sin coste monetario suelen pagarse con publicidad o mediante la venta de los datos del usuario.","Conocimiento"
2,1,1,"Inglés","Aware that online content that is available to users at no monetary cost is often paid for by advertising or by selling the user’s data.","Knowledge"
3,1,1,"Español","Es consciente de que los resultados de las búsquedas, los flujos de actividad en las redes sociales y las recomendaciones de contenidos en Internet están influenciados por una serie de factores. Estos factores incluyen los términos de búsqueda utilizados, el contexto (por ejemplo, la ubicación geográfica), el dispositivo (por ejemplo, un ordenador portátil o un teléfono móvil), la normativa local (que a veces dicta lo que puede o no puede mostrarse), el comportamiento de otros usuarios (por ejemplo, las búsquedas de tendencia o las recomendaciones) y el comportamiento anterior del usuario en Internet.","Conocimiento"
3,1,1,"Inglés","Aware that search results, social media activity streams and content recommendations on the internet are influenced by a range of factors. These factors include the search terms used, the context (e.g. geographical location), the device (e.g. laptop or mobile phone), local regulations (which sometimes dictate what can or cannot be shown), the behaviour of other users (e.g. trending searches or recommendations) and the user’s past online behaviour across the internet.","Knowledge"
4,1,1,"Español","Es consciente de que los motores de búsqueda, las redes sociales y las plataformas de contenidos suelen utilizar algoritmos de IA para generar respuestas adaptadas al usuario individual (por ejemplo, las personas siguen viendo resultados o contenidos similares). Esto a menudo se denomina “personalización”.","Conocimiento"
4,1,1,"Inglés","Aware that search engines, social media and content platforms often use AI algorithms to generate responses that are adapted to the individual user (e.g. users continue to see similar results or content). This is often referred to as “personalisation”.","Knowledge"
5,1,1,"Español","Es consciente de que los algoritmos de IA funcionan de manera que no suelen ser visibles o fáciles de entender para las personas. Esto se denomina a menudo “caja negra” en la toma de decisiones, ya que puede ser imposible rastrear cómo y por qué un algoritmo hace sugerencias o predicciones específicas.","Conocimiento"
5,1,1,"Inglés","Aware that AI algorithms work in ways that are usually not visible or easily understood by users. This is often referred to as “black box” decision-making as it may be impossible to trace back how and why an algorithm makes specific suggestions or predictions.","Knowledge"
6,1,1,"Español","Puede elegir el motor de búsqueda que más se ajuste a sus necesidades de información ya que distintos motores de búsqueda pueden ofrecer resultados diferentes incluso para la misma consulta.","Habilidades"
6,1,1,"Inglés","Can choose the search engine that most likely meets one’s information needs as different search engines can provide different results even for the same query.","Skills"
7,1,1,"Español","Sabe cómo mejorar los resultados de la búsqueda utilizando las funciones avanzadas de un motor de búsqueda (por ejemplo, especificando la frase exacta, el idioma, la región, la fecha de la última actualización).","Habilidades"
7,1,1,"Inglés","Knows how to improve search results by using a search engine’s advanced features (e.g. specifying exact phrase, language, region, date last updated).","Skills"
8,1,1,"Español","Sabe formular consultas de búsqueda para conseguir el resultado deseado al interactuar con agentes conversacionales o altavoces inteligentes (por ejemplo, Siri, Alexa, Cortana, Google Assistant), por ejemplo, reconociendo que, para que el sistema pueda responder como es debido, la consulta debe ser inequívoca y dictada con claridad para que el sistema pueda responder.","Habilidades"
8,1,1,"Inglés","Knows how to formulate search queries to achieve the desired output when interacting with conversational agents or smart speakers (e.g. Siri, Alexa, Cortana, Google Assistant), e.g. recognising that, for the system to be able to respond as required, the query must be unambiguous and spoken clearly so that the system can respond.","Skills"
9,1,1,"Español","Puede utilizar la información presentada en forma de hipervínculos, en forma no textual (por ejemplo, diagramas de flujo, mapas de conocimiento) y en representaciones dinámicas (por ejemplo, datos).","Habilidades"
9,1,1,"Inglés","Can make use of information presented as hyperlinks, in non-textual form (e.g. flowcharts, knowledge maps) and in dynamic representations (e.g. data).","Skills"
10,1,1,"Español","Desarrolla métodos de búsqueda eficaces para fines personales (por ejemplo, para consultar una lista de las películas más populares) y profesionales (por ejemplo, para encontrar anuncios de trabajo adecuados).","Habilidades"
10,1,1,"Inglés","Develops effective search methods for personal purposes (e.g. to browse a list of most popular films) and professional purposes (e.g. to find appropriate job advertisements).","Skills"
11,1,1,"Español","Sabe cómo manejar la sobrecarga de información y la “infodemia” (es decir, el aumento de información falsa o engañosa durante un brote de enfermedad) adaptando los métodos y estrategias de búsqueda personales","Habilidades"
11,1,1,"Inglés","Knows how to handle information overload and “infodemic” (i.e. increase of false or misleading information during a disease outbreak ) by adapting personal search methods and strategies.","Skills"
12,1,1,"Español","Evita intencionadamente las distracciones y pretende evitar la sobrecarga de información al acceder y navegar por la información, los datos y los contenidos.","Actitudes"
12,1,1,"Inglés","Intentionally avoids distractions and aims to avoid information overload when accessing and navigating information, data and content.","Attitudes"
13,1,1,"Español","Valora las herramientas diseñadas para proteger la privacidad de las búsquedas y otros derechos de las personas (por ejemplo, navegadores como DuckDuckGo).","Actitudes"
13,1,1,"Inglés","Values tools designed to protect search privacy and other rights of users (e.g. browsers such as DuckDuckGo).","Attitudes"
14,1,1,"Español","Sopesa los beneficios y las desventajas de utilizar motores de búsqueda basados en la IA(por ejemplo, aunque puedan ayudar a las personas a encontrar la información deseada, pueden comprometer la privacidad y los datos personales, o someter al usuario a intereses comerciales).","Actitudes"
14,1,1,"Inglés","Weighs the benefits and disadvantages of using AI-driven search engines (e.g. while they might help users find the desired information, they may compromise privacy and personal data, or subject the user to commercial interests).","Attitudes"
15,1,1,"Español","Preocupados por el hecho de que gran parte de la información y los contenidos en línea pueden no ser accesibles para las personas con discapacidad, por ejemplo para las personas que dependen de las tecnologías de lectura de pantalla para leer en voz alta el contenido de una página web","Actitudes"
15,1,1,"Inglés","Concerned that much online information and content may not be accessible to people with a disability, for example to users who rely on screen reader technologies to read aloud the content of a web page.","Attitudes"
16,1,2,"Español","Es consciente de que los entornos en línea contienen todo tipo de información y contenido, incluida la información errónea y a la desinformación, y que aunque un tema sea ampliamente difundido no tiene por qué significar que la información sea exacta.","Conocimiento"
16,1,2,"Inglés","Aware that online environments contain all types of information and content including misinformation and disinformation, and even if a topic is widely reported it does not necessarily mean it is accurate.","Knowledge"
17,1,2,"Español","Comprende la diferencia entre desinformación (información falsa con la intención de engañar) y desinformación (información falsa sin intención de engañar o confundir).","Conocimiento"
17,1,2,"Inglés","Understands the difference between disinformation (false information with the intent to deceive people) and misinformation (false information regardless of intent to deceive or mislead people).","Knowledge"
18,1,2,"Español","Conoce la importancia de identificar quién está detrás de la información que se encuentra en Internet (por ejemplo, en las redes sociales) y de verificarla comprobando múltiples fuentes, para ayudar a reconocer y comprender el punto de vista o la parcialidad que hay detrás de una información concreta y de las fuentes de datos","Conocimiento"
18,1,2,"Inglés","Knows the importance of identifying who is behind information found on the internet (e.g. on social media) and verifying it by checking multiple sources, to help recognise and understand point of view or bias behind particular information and data sources","Knowledge"
19,1,2,"Español","Es consciente de los posibles sesgos informativos causados por diversos factores (por ejemplo, datos, algoritmos, elecciones editoriales, censura, las propias limitaciones personales).","Conocimiento"
19,1,2,"Inglés","Aware of potential information biases caused by various factors (e.g. data, algorithms, editorial choices, censorship, one’s own personal limitations).","Knowledge"
20,1,2,"Español","Sabe que el término deep-fakes se refiere a las imágenes, vídeos o grabaciones de audio generados por la IA de eventos o personas que no sucedieron realmente (por ejemplo, discursos de políticos, rostros de famosos en imágenes pornográficas). Pueden ser imposibles de distinguir de los auténticos.","Conocimiento"
20,1,2,"Inglés","Knows that the term “deep-fakes” refers to AI-generated images, videos or audio recordings of events or persons that did not really happen (e.g. speeches by politicians, celebrity faces on pornographic imagery). They may be impossible to distinguish from the real thing.","Knowledge"
21,1,2,"Español","Es consciente de que los algoritmos de IA pueden no estar configurados para proporcionar únicamente la información que se desea; también pueden incorporar un mensaje comercial o político (por ejemplo, para animar a las personas a permanecer en el sitio, para ver o comprar algo en particular, para compartir opiniones específicas). Esto también puede tener consecuencias negativas (por ejemplo, reproducir estereotipos o compartir información erronea.","Conocimiento"
21,1,2,"Inglés","Aware that AI algorithms might not be configured to provide only the information that the user wants; they might also embody a commercial or political message (e.g. to encourage users to stay on the site, to watch or buy something particular, to share specific opinions). This can also have negative consequences (e.g. reproducing stereotypes, sharing misinformation).","Knowledge"
22,1,2,"Español","Es consciente de que los datos, de los que depende la IA, pueden incluir sesgos. Si es así, estos sesgos pueden automatizarse y empeorar con el uso de la IA. Por ejemplo, los resultados de la búsqueda sobre la ocupación pueden incluir estereotipos sobre trabajos masculinos o femeninos (por ejemplo, conductores de autobús masculinos, vendedoras femeninas).","Conocimiento"
22,1,2,"Inglés","Aware that the data, on which AI depends, may include biases. If so, these biases can become automated and worsened by the use of AI. For example, search results about occupation may include stereotypes about male or female jobs (e.g. male bus drivers, female sales persons).","Knowledge"
23,1,2,"Español","Considera cuidadosamente los primeros resultados de búsqueda, tanto en las búsquedas de texto como de audio, ya que pueden reflejar intereses comerciales y de otro tipo en lugar de ser los resultados más adecuados para la consulta.","Habilidades"
23,1,2,"Inglés","Carefully considers the top/first search results in both text-based and audio searches, as they may reflect commercial and other interests rather than be the most appropriate results for the query.","Skills"
24,1,2,"Español","Sabe diferenciar los contenidos patrocinados de otros contenidos en línea (por ejemplo, reconocer los anuncios y mensajes de marketing en las redes sociales o en los motores de búsqueda) aunque no estén marcados como patrocinados.","Habilidades"
24,1,2,"Inglés","Knows how to differentiate sponsored content from other content online (e.g. recognising advertisements and marketing messages on social media or search engines) even if it is not marked as sponsored.","Skills"
25,1,2,"Español","Sabe analizar y evaluar de forma crítica los resultados de las búsquedas y los flujos de actividad de las redes sociales, para identificar sus orígenes, distinguir la información basada hechos de la opinión y determinar si los resultados son veraces o tienen otras limitaciones (por ejemplo, intereses económicos, políticos o religiosos).","Habilidades"
25,1,2,"Inglés","Knows how to analyse and critically evaluate search results and social media activity streams, to identify their origins, to distinguish fact-reporting from opinion, and to determine whether outputs are truthful or have other limitations (e.g. economic, political, religious interests).","Skills"
26,1,2,"Español","Sabe cómo encontrar al autor o autora o la fuente de la información, para verificar si es creíble (por ejemplo, un experto o autoridad en una disciplina pertinente).","Habilidades"
26,1,2,"Inglés","Knows how to find the author or the source of the information, to verify whether it is credible (e.g. an expert or authority in a relevant discipline).","Skills"
27,1,2,"Español","Es capaz de reconocer que algunos algoritmos de IA pueden reforzar las opiniones existentes en los entornos.","Habilidades"
27,1,2,"Inglés","Able to recognise that some AI algorithms may reinforce existing views in digital environments by creating “echo chambers” or “filter bubbles” (e.g. if a social media stream favours a particular political ideology, additional recommendations can reinforce that ideology without exposing it to opposing arguments).","Skills"
28,1,2,"Español","Tiende a plantear preguntas críticas para evaluar la calidad de la información en línea, y preocupados por los propósitos que hay detrás de la difusión y amplificación de la desinformación.","Actitudes"
28,1,2,"Inglés","Inclined to ask critical questions in order to evaluate the quality of online information, and concerned about purposes behind spreading and amplifying disinformation.","Attitudes"
29,1,2,"Español","Estar dispuesto a comprobar una información y evaluar su exactitud, fiabilidad y autoridad, prefiriendo, siempre que sea posible, las fuentes primarias a las secundarias.","Actitudes"
29,1,2,"Inglés","Willing to fact-check a piece of information and assess its accuracy, reliability and authority, while preferring primary sources over secondary sources of information where possible.","Attitudes"
30,1,2,"Español","Considera cuidadosamente el posible resultado antes de hacer clic en un enlace. Algunos enlaces (por ejemplo, títulos atractivos) podrían ser “clickbait” que llevan al usuario a contenidos patrocinados o no deseados (por ejemplo, pornografía).","Actitudes"
30,1,2,"Inglés","Carefully considers the possible outcome before clicking a link. Some links (e.g. compelling titles) could be “clickbait” that takes the user to sponsored or unwanted content (e.g. pornography).","Attitudes"
31,1,3,"Español","Es consciente de que muchas aplicaciones de Internet y de los teléfonos móviles recogen y procesan datos (datos personales, datos de comportamiento y datos contextuales) a los que se puede acceder o recuperar, por ejemplo, para controlar sus actividades en línea (por ejemplo, los clics en las redes sociales, las búsquedas en Google) y fuera de línea (por ejemplo, los pasos diarios, los viajes en el transporte público).","Conocimiento"
31,1,3,"Inglés","Aware that many applications on the internet and mobile phones collect and process data (personal data, behavioural data and contextual data) that the user can access or retrieve, for example, to monitor their activities online (e.g. clicks in social media, searches on Google) and offline (e.g. daily steps, bus rides on public transport).","Knowledge"
32,1,3,"Español","Es consciente de que para que los datos (por ejemplo, números, textos, imágenes, sonidos) puedan ser procesados por un programa, primero tienen que estar debidamente digitalizados (es decir, codificados digitalmente).","Conocimiento"
32,1,3,"Inglés","Aware that for data (e.g. numbers, text, images, sounds) to be processed by a program, they have to be first properly digitised (i.e. digitally encoded).","Knowledge"
33,1,3,"Español","Sabe que los datos recogidos y procesados, por ejemplo, por los sistemas en línea, pueden ser utilizados para reconocer patrones (por ejemplo, repeticiones) en nuevos datos (por ejemplo, otras imágenes, sonidos, clics del ratón, comportamientos en línea) para optimizar y personalizar aún más los servicios en línea (por ejemplo, los anuncios).","Conocimiento"
33,1,3,"Inglés","Knows that data collected and processed, for example by online systems, can be used to recognise patterns (e.g. repetitions) in new data (i.e. other images, sounds, mouse clicks, online behaviours) to further optimise and personalise online services (e.g. advertisements).","Knowledge"
34,1,3,"Español","Es consciente de que los sensores utilizados en muchas tecnologías y aplicaciones digitales (por ejemplo, las cámaras de seguimiento facial, los asistentes virtuales, las tecnologías ponibles, los teléfonos móviles, los dispositivos inteligentes) generan grandes cantidades de datos, incluidos los datos personales, que pueden utilizarse para entrenar un sistema de IA.","Conocimiento"
34,1,3,"Inglés","Aware that sensors used in many digital technologies and applications (e.g. facial tracking cameras, virtual assistants, wearable technologies, mobile phones, smart devices) generate large amounts of data, including personal data, that can be used to train an AI system.","Knowledge"
35,1,3,"Español","Sabe que existen repositorios de datos abiertos en los que cualquiera puede obtener datos para apoyar algunas actividades de resolución de problemas (por ejemplo, la ciudadanía pueden utilizar datos abiertos para generar mapas temáticos u otros contenidos digitales).","Conocimiento"
35,1,3,"Inglés","Knows that open data repositories exist where anyone can get data to support some problem solving activities (e.g. citizens can use open data to generate thematic maps or other digital content).","Knowledge"
36,1,3,"Español","Sabe cómo recopilar datos digitales utilizando herramientas básicas, como formularios en línea, y presentarlos de forma accesible (por ejemplo, utilizando encabezados en los cuadros).","Habilidades"
36,1,3,"Inglés","Knows how to collect digital data using basic tools such as online forms, and present them in an accessible way (e.g. using headers in tables).","Skills"
37,1,3,"Español","Puede aplicar procedimientos estadísticos básicos a los datos en un entorno estructurado (por ejemplo, una hoja de cálculo) para producir gráficos y otras visualizaciones (por ejemplo, histogramas, diagramas de barras, diagramas circulares).","Habilidades"
37,1,3,"Inglés","Can apply basic statistical procedures to data in a structured environment (e.g. spreadsheet) to produce graphs and other visualisations (e.g. histograms, bar charts, pie charts).","Skills"
38,1,3,"Español","Sabe interactuar con la visualización de datos dinámicos y puede manipular gráficos dinámicos de interés (por ejemplo, los proporcionados por Eurostat, sitios web gubernamentales).","Habilidades"
38,1,3,"Inglés","Knows how to interact with dynamic data visualisation and can manipulate dynamic graphs of interest (e.g. as provided by Eurostat, government websites).","Skills"
39,1,3,"Español","Puede diferenciar entre los diferentes tipos de lugares de almacenamiento (dispositivos locales, red local, nube) que son los más adecuados para utilizar (por ejemplo, los datos en la nube están disponibles en cualquier momento y desde cualquier lugar, pero tiene implicaciones en el tiempo de acceso).","Habilidades"
39,1,3,"Inglés","Can differentiate between different types of storage locations (local devices, local network, cloud) that are the most appropriate to use (e.g. data on the cloud is available anytime and from anywhere, but has implications for access time).","Skills"
40,1,3,"Español","Puede utilizar herramientas de datos (por ejemplo, bases de datos, minería de datos, software de análisis) diseñadas para gestionar y organizar información compleja, para apoyar la toma de decisiones y la resolución de problemas.","Habilidades"
40,1,3,"Inglés","Can use data tools (e.g. databases, data mining, analysis software) designed to manage and organise complex information, to support decision-making and solving problems.","Skills"
41,1,3,"Español","Tiene en cuenta la transparencia a la hora de manipular y presentar los datos para garantizar su fiabilidad, y detecta los datos que se expresan con motivos subyacentes (por ejemplo, falta de ética, beneficio, manipulación) o de forma engañosa.","Actitudes"
41,1,3,"Inglés","Considers transparency when manipulating and presenting data to ensure reliability, and spots data that are expressed with underlying motives (e.g. unethical, profit, manipulation) or in misleading ways.","Attitudes"
42,1,3,"Español","Cuidado con la precisión al evaluar representaciones sofisticadas de los datos (por ejemplo, cuadros o visualizaciones, ya que podrían utilizarse para inducir a error al tratar de dar una falsa sensación de objetividad.","Actitudes"
42,1,3,"Inglés","Watchful of accuracy when evaluating sophisticated representations of data (e.g. tables or visualisations as they could be used to mislead one’s judgement by trying to give a false sense of objectivity.","Attitudes"
43,2,1,"Español","Sabe que muchos servicios de comunicación (por ejemplo, la mensajería instantánea) y las redes sociales son gratuitos porque se pagan en parte con publicidad y con la monetización de los datos personales.","Conocimiento"
43,2,1,"Inglés","Knows that many communication services (e.g. instant messaging) and social media are free of charge because they are partly paid for by advertising and monetising user data.","Knowledge"
44,2,1,"Español","Es consciente de que muchos servicios de comunicación y entornos digitales (por ejemplo, las redes sociales) utilizan mecanismos como el nudging, la gamificación y la manipulación para influir en el comportamiento de las personas.","Conocimiento"
44,2,1,"Inglés","Aware that many communication services and digital environments (e.g. social media) use mechanisms such as nudging, gamification and manipulation to influence user behaviour.","Knowledge"
45,2,1,"Español","Sabe qué herramientas y servicios de comunicación (por ejemplo, teléfono, correo electrónico, videoconferencia, red social, podcast) son apropiados en circunstancias específicas (por ejemplo, sincrónico, asincrónico), dependiendo de la audiencia, el contexto y el propósito de la comunicación. Sabe que algunas herramientas y servicios también ofrecen una declaración de accesibilidad.","Conocimiento"
45,2,1,"Inglés","Aware which communication tools and services (e.g. phone, email, video conference, social network, podcast) are appropriate in specific circumstances (e.g. synchronous, asynchronous), depending on the audience, context and purpose of the communication. Aware that some tools and services also provide an accessibility statement.","Knowledge"
46,2,1,"Español","Es consciente de la necesidad de formular los mensajes en entornos digitales para que sean fácilmente comprensibles por el público al que se dirigen o el destinatario.","Conocimiento"
46,2,1,"Inglés","Aware of the need to formulate messages in digital environments so that they are easily understandable by the targeted audience or the recipient.","Knowledge"
47,2,1,"Español","Sabe utilizar diversas funciones de videoconferencia (por ejemplo, moderar una sesión, grabar audio y vídeo).","Habilidades"
47,2,1,"Inglés","Knows how to use a variety of videoconferencing features (e.g. moderating a session, recording audio and video).","Skills"
48,2,1,"Español","Es capaz de lograr una comunicación eficaz en modo asíncrono (no simultáneo) utilizando herramientas digitales (por ejemplo, para informar y dar instrucciones, compartir ideas, hacer comentarios y asesoramiento, programación de reuniones, comunicación de hitos).","Habilidades"
48,2,1,"Inglés","Able to achieve effective communication in asynchronous (non-simultaneous) mode using digital tools (e.g. for reporting and briefing, sharing ideas, giving feedback and advice, scheduling meetings, communicating milestones).","Skills"
