"ID_ejemplo","ID_area","ID_competencia","Idioma","Texto","Tipo"
49,2,1,"Español","Sabe utilizar las herramientas digitales para la comunicación informal con los colegas con el fin de desarrollar y mantener las relaciones sociales (por ejemplo, para reproducir conversaciones como las que se producen durante las pausas para el café cara a cara).","Habilidades"
49,2,1,"Inglés","Knows how to use digital tools for informal communication with colleagues in order to develop and maintain social relations (e.g. to reproduce conversations such as those during face-to-face coffee breaks).","Skills"
50,2,1,"Español","Sabe identificar las señales que indican si se está comunicando con un humano o con un agente conversacional basado en la IA (por ejemplo, cuando se utilizan chatbots basados en texto o en voz).","Habilidades"
50,2,1,"Inglés","Knows how to identify signs that indicate whether one is communicating with a human or an AI-based conversational agent (e.g. when using text- or voice-based chatbots).","Skills"
51,2,1,"Español","Poder interactuar y hacer comentarios al sistema de IA (por ejemplo, dando calificaciones de usuario, gustos, etiquetas a los contenidos en línea) para influir en lo que recomienda a continuación (por ejemplo, para obtener más recomendaciones sobre películas similares que le hayan gustado previamente al usuario).","Habilidades"
51,2,1,"Inglés","Able to interact and give feedback to the AI system (e.g. by giving user ratings, likes, tags to online content) to influence what it next recommends (e.g. to get more recommendations on similar movies that the user previously liked).","Skills"
52,2,1,"Español","Considera la necesidad de equilibrar las actividades de comunicación asíncronas y síncronas (por ejemplo, para minimizar la fatiga de las videoconferencias, para respetar el tiempo de los compañeros y los horarios de trabajo preferidos).","Habilidades"
52,2,1,"Inglés","Considers the need to balance asynchronous and synchronous communication activities (e.g. to minimise video conferencing fatigue, to respect co-workers time and preferred working hours).","Skills"
53,2,1,"Español","Está dispuesto a escuchar a los demás y a entablar conversaciones en línea con confianza, claridad y reciprocidad, tanto en contextos personales como sociales.","Actitudes"
53,2,1,"Inglés","Willing to listen to others and to engage in online conversations with confidence, clarity and reciprocity, both in personal and social contexts.","Attitudes"
54,2,1,"Español","Se abre a que los sistemas de IA apoyen a los humanos a tomar decisiones informadas de acuerdo con sus objetivos (por ejemplo, que las personas decidan activamente si actúan o no según una recomendación).","Actitudes"
54,2,1,"Inglés","Open to AI systems supporting humans to make informed decisions in accordance with their goals (e.g. users actively deciding whether to act upon a recommendation or not).","Attitudes"
55,2,1,"Español","Está dispuesto a adaptar una estrategia de comunicación adecuada en función de la situación y la herramienta digital: estrategias verbales (lenguaje escrito, oral), estrategias no verbales (lenguaje corporal, expresiones faciales, tono de voz), estrategias visuales (signos, iconos, ilustraciones) o estrategias mixtas.","Actitudes"
55,2,1,"Inglés","Willing to adapt an appropriate communication strategy depending on the situation and digital tool: verbal strategies (written, oral language), non-verbal strategies (body language, facial expressions, tone of voice), visuals strategies (signs, icons, illustrations) or mixed strategies.","Attitudes"
56,2,2,"Español","Es consciente de que todo lo que se comparte públicamente en línea (por ejemplo, imágenes, vídeos, sonidos) puede utilizarse para entrenar sistemas de IA. Por ejemplo, las empresas de software comercial que desarrollan sistemas de reconocimiento facial con IA pueden utilizar imágenes personales compartidas en línea (por ejemplo, fotografías familiares) para entrenar y mejorar la capacidad del software para reconocer automáticamente a esas personas en otras imágenes, lo que podría no ser deseable (por ejemplo, podría ser una violación de la privacidad).","Conocimiento"
56,2,2,"Inglés","Aware that everything that one shares publicly online (e.g. images, videos, sounds) can be used to train AI systems. For example, commercial software companies who develop AI facial recognition systems can use personal images shared online (e.g. family photographs) to train and improve the software’s capability to automatically recognise those persons in other images, which might not be desirable (e.g. might be a breach of privacy).","Knowledge"
57,2,2,"Español","Conoce el papel y las responsabilidades del facilitador en línea para estructurar y guiar un grupo de discusión (por ejemplo, cómo actuar como intermediario al compartir información y contenidos digitales en entornos digitales).","Conocimiento"
57,2,2,"Inglés","Knows the role and responsibilities of the online facilitator to structure and guide a discussion group (e.g. how to act as an intermediary when sharing information and digital content in digital environments).","Knowledge"
58,2,2,"Español","Sabe cómo compartir contenidos digitales (por ejemplo, imágenes) en múltiples dispositivos (por ejemplo, desde teléfonos inteligentes hasta servicios en la nube).","Habilidades"
58,2,2,"Inglés","Knows how to share digital content (e.g. pictures) across multiple devices (e.g. from smartphones to cloud services).","Skills"
59,2,2,"Español","Sabe compartir y mostrar información desde el propio dispositivo (por ejemplo, mostrar gráficos desde un ordenador portátil) para apoyar un mensaje que se transmite durante una sesión en línea en tiempo real (por ejemplo, una videoconferencia).","Habilidades"
59,2,2,"Inglés","Knows how to share and show information from one’s own device (e.g. show graphs from a laptop) to support a message being conveyed during a real time online session (e.g. video conference).","Skills"
60,2,2,"Español","Puede seleccionar y restringir con quién se comparte el contenido (por ejemplo, dar acceso solo a los amigos en las redes sociales, permitir que solo los compañeros de trabajo lean y comenten un texto).","Habilidades"
60,2,2,"Inglés","Able to select and restrict with whom the content is shared (e.g. giving access only to friends on social media, allowing only co-workers to read and comment on a text).","Skills"
61,2,2,"Español","Sabe cómo conservar el contenido en las plataformas de intercambio de contenidos para añadir valor para uno mismo y para los demás (por ejemplo, comparte listas de reproducción de música, comparte comentarios en servicios en línea).","Habilidades"
61,2,2,"Inglés","Knows how to curate content on content sharing platforms so as to add value for oneself and others (e.g. shares music playlists, shares comments on online services).","Skills"
62,2,2,"Español","Sabe reconocer la fuente original y los autores o autoras de los contenidos compartidos.","Habilidades"
62,2,2,"Inglés","Knows how to acknowledge the original source and authors of shared content.","Skills"
63,2,2,"Español","Sabe cómo señalar o denunciar la desinformación y la información errónea a las organizaciones de comprobación de hechos y a las plataformas de redes sociales para impedir su difusión.","Habilidades"
63,2,2,"Inglés","Knows how to flag or report disinformation and misinformation to fact-checking organisations and to social media platforms in order to stop it spreading.","Skills"
64,2,2,"Español","Está dispuesto a compartir sus conocimientos en Internet, por ejemplo, interviniendo en foros en línea, contribuyendo a Wikipedia o creando recursos educativos abiertos.","Actitudes"
64,2,2,"Inglés","Willing to share expertise on the internet, for example through intervening in online forums, contributing to Wikipedia or through creating Open Educational Resources.","Attitudes"
65,2,2,"Español","Se abre a compartir contenidos digitales que puedan ser interesantes y útiles para otros.","Actitudes"
65,2,2,"Inglés","Open towards sharing digital content that might be interesting and useful to others.","Attitudes"
66,2,2,"Español","Tendencia a no compartir los recursos digitales si no se pueden citar su autor o autora o fuente de forma adecuada.","Actitudes"
66,2,2,"Inglés","Inclined not to share digital resources if not able to cite their author or source in an appropriate manner.","Attitudes"
67,2,3,"Español","Conoce los diferentes tipos de servicios digitales en Internet: los públicos (por ejemplo, servicios para consultar información fiscal o pedir cita en el centro de salud), los comunitarios (por ejemplo, repositorios de conocimiento como Wikipedia, servicios de mapas como Open Street Map, servicios medioambientales de vigilancia como la Comunidad de sensores) y servicios privados (por ejemplo, comercio electrónico, banca en línea).","Conocimiento"
67,2,3,"Inglés","Knows about different types of digital services on the internet: public ones (e.g. services to consult tax information or make an appointment in the health care centre), community-based services (e.g. knowledge repositories such as Wikipedia, map services such as Open Street Map, environmental monitoring services such as Sensor Community) and private services (e.g. e-commerce, online banking).","Knowledge"
68,2,3,"Español","Sabe que una identificación electrónica segura, (por ejemplo, carnés de identidad que contengan certificados digitales), permite a la ciudadanía aumentar la seguridad cuando utilizan los servicios en línea proporcionados por la administración o por el sector privado.","Conocimiento"
68,2,3,"Inglés","Knows that a secure electronic identification, (e.g. identity cards which contain digital certificates), enables citizens to increase safety when using online services provided by the government or by the private sector.","Knowledge"
69,2,3,"Español","Sabe que todos la ciudadanía de la UE tienen derecho a no ser sometidos a una toma de decisiones totalmente automatizada (por ejemplo, si un sistema automático rechaza una solicitud de crédito, el cliente tiene derecho a pedir que la decisión sea revisada por una persona).","Conocimiento"
69,2,3,"Inglés","Knows that all EU citizens have the right to not be subject to fully automated decisionmaking (e.g. if an automatic system refuses a credit application, the customer has the right to ask for the decision to be reviewed by a person).","Knowledge"
70,2,3,"Español","Reconoce que, si bien la aplicación de sistemas de IA en muchos ámbitos no suele ser controvertida (por ejemplo, la IA que ayuda a evitar el cambio climático), la IA que interactúa directamente con los seres humanos y toma decisiones sobre su vida puede ser a menudo controvertida (por ejemplo, los programas informáticos de clasificación de currículos para los procedimientos de contratación, la calificación de exámenes que pueden determinar el acceso a la educación).","Conocimiento"
70,2,3,"Inglés","Recognises that while the application of AI systems in many domains is usually uncontroversial (e.g. AI that helps avert climate change), AI that directly interacts with humans and takes decisions about their life can often be controversial (e.g. CV-sorting software for recruitment procedures, scoring of exams that may determine access to education).","Knowledge"
71,2,3,"Español","Sabe que la IA en sí no es ni buena ni mala. Lo que determina si los resultados de un sistema de IA son positivos o negativos para la sociedad es cómo se diseña y utiliza el sistema de IA, quién lo usa y con qué fines.","Conocimiento"
71,2,3,"Inglés","Knows that AI per se is neither good nor bad. What determines whether the outcomes of an AI system are positive or negative for society are how the AI system is designed and used, by whom and for what purposes.","Knowledge"
72,2,3,"Español","Es consciente de las plataformas de la sociedad civil en Internet que ofrecen oportunidades para que la ciudadanía participen en acciones dirigidas a desarrollos globales para alcanzar los objetivos de sostenibilidad a escala local, regional, nacional, europea e internacional.","Conocimiento"
72,2,3,"Inglés","Aware of civil society platforms on the internet that offer opportunities for citizens to participate in actions targeting global developments to reach sustainability goals on local, regional, national, European and international level.","Knowledge"
73,2,3,"Español","Es consciente del papel de los medios de comunicación tradicionales (por ejemplo, periódicos, televisión) y de los nuevos (por ejemplo, redes sociales, Internet) en las sociedades democráticas.","Conocimiento"
73,2,3,"Inglés","Aware of the role of traditional (e.g. newspapers, television) and new forms of media (e.g. social media, the internet) in democratic societies.","Knowledge"
74,2,3,"Español","Sabe cómo adquirir certificados de una autoridad de certificación (AC) a efectos de una identificación electrónica segura.","Habilidades"
74,2,3,"Inglés","Knows how to acquire certificates from a certification authority (CA) for the purpose of a secure electronic identification.","Skills"
75,2,3,"Español","Sabe cómo controlar el gasto público de la administración local y nacional (por ejemplo, a través de datos abiertos en la página web de la administración y en portales de datos abiertos).","Habilidades"
75,2,3,"Inglés","Knows how to monitor public spending of local and national government (e.g. through open data on the government’s website and open data portals).","Skills"
76,2,3,"Español","Sabe identificar las áreas en las que la IA puede aportar beneficios a diversos aspectos de la vida cotidiana. Por ejemplo, en el ámbito de la salud, la IA podría contribuir al diagnóstico precoz, mientras que en la agricultura podría utilizarse para detectar infestaciones de plagas.","Habilidades"
76,2,3,"Inglés","Knows how to identify areas where AI can bring benefits to various aspects of everyday life. For example, in healthcare, AI might contribute to early diagnosis, while in agriculture, it might be used to detect pest infestations.","Skills"
77,2,3,"Español","Sabe cómo comprometerse con otros a través de las tecnologías digitales para el desarrollo sostenible de la sociedad (por ejemplo, crear oportunidades de acción conjunta entre comunidades, sectores y regiones con diferentes intereses en los desafíos de la sostenibilidad) con una conciencia del potencial de la tecnología tanto para la inclusión/participación como para la exclusión.","Habilidades"
77,2,3,"Inglés","Knows how to engage with others through digital technologies for the sustainable development of society (e.g. create opportunities for joint action across communities, sectors and regions with different interests in sustainability challenges) with an awareness of technology´s potential for both inclusion/participation and exclusion.","Skills"
78,2,3,"Español","Se abre a cambiar las propias rutinas administrativas y adoptar procedimientos digitales cuando se trata de la administración y los servicios públicos.","Actitudes"
78,2,3,"Inglés","Open to change one’s own administrative routines and adopt digital procedures when dealing with government and public services.","Attitudes"
79,2,3,"Español","Estar dispuesto a contemplar cuestiones éticas relacionadas con los sistemas de IA (por ejemplo, en qué contextos, como, por ejemplo, en la condena de delincuentes, no deberían utilizarse las recomendaciones de la IA sin intervención humana)","Actitudes"
79,2,3,"Inglés","Readiness to contemplate ethical questions related to AI systems (e.g. in which contexts, such as sentencing criminals, should AI recommendations not be used without human intervention)?","Attitudes"
80,2,3,"Español","Considera que las actitudes responsables y constructivas en Internet son la base de los derechos humanos, junto con valores como el respeto a la dignidad humana, la libertad, la democracia y la igualdad.","Actitudes"
80,2,3,"Inglés","Considers responsible and constructive attitudes on the internet as they are the foundation for human rights, together with values such as respect for human dignity, freedom, democracy and equality.","Attitudes"
81,2,3,"Español","Es proactivo en el uso de Internet y de las tecnologías digitales para buscar oportunidades de participación constructiva en la toma de decisiones democráticas y en las actividades cívicas (por ejemplo, participando en consultas organizadas por el municipio, los responsables políticos o las ONG; firmando una petición a través de una plataforma digital).","Actitudes"
81,2,3,"Inglés","Proactive about using the internet and digital technologies to seek opportunities for constructive participation in democratic decision-making and civic activities (e.g. by participating in consultations organised by municipality, policy-makers, NGOs; signing a petition using a digital platform).","Attitudes"
82,2,4,"Español","Es consciente de las ventajas de utilizar herramientas y tecnologías digitales para los procesos de colaboración a distancia (por ejemplo, reducción del tiempo de desplazamiento, unir competencias especializadas independientemente de la ubicación).","Conocimiento"
82,2,4,"Inglés","Aware of the advantages of using digital tools and technologies for remote collaborative processes (e.g. reduced commuting time, join specialised skills together regardless of location).","Knowledge"
83,2,4,"Español","Comprende que, para cocrear contenidos digitales con otras personas, es importante contar con buenas habilidades sociales (por ejemplo, comunicación clara, capacidad de aclarar malentendidos) para compensar las limitaciones de la comunicación en línea.","Conocimiento"
83,2,4,"Inglés","Understands that in order to co-create digital content with other people, good social skills (e.g. clear communication, ability to clarify misunderstandings) are important to compensate for the limitations of online communication .","Knowledge"
84,2,4,"Español","Sabe utilizar herramientas digitales en un contexto de colaboración para planificar y compartir tareas y responsabilidades dentro de un grupo de amigos, una familia o un equipo deportivo o de trabajo (por ejemplo, agenda digital, planificadores de viajes y actividades de ocio).","Habilidades"
84,2,4,"Inglés","Knows how to use digital tools in a collaborative context to plan and share tasks and responsibilities within a group of friends, a family or a sport or work team (e.g. digital calendar, planners for trips and leisure activities).","Skills"
85,2,4,"Español","Sabe utilizar las herramientas digitales para facilitar y mejorar los procesos de colaboración, por ejemplo, mediante tableros visuales compartidos y lienzos digitales (por ejemplo, Mural, Miro, Padlet).","Habilidades"
85,2,4,"Inglés","Knows how to use digital tools to facilitate and improve collaborative processes, for example through shared visual boards and digital canvases (e.g. Mural, Miro, Padlet).","Skills"
86,2,4,"Español","Sabe cómo participar en colaboración en un wiki (por ejemplo, negociar la apertura de una nueva entrada sobre un tema que falta en la Wikipedia para aumentar el conocimiento público).","Habilidades"
86,2,4,"Inglés","Knows how to engage collaboratively in a wiki (e.g. negotiate opening a new entry on a subject that is missing from Wikipedia to increase public knowledge).","Skills"
87,2,4,"Español","Sabe utilizar herramientas y tecnologías digitales en un contexto de teletrabajo para la generación de ideas y la cocreación de contenidos digitales (por ejemplo, mapas mentales y pizarras blancas compartidas, herramientas de votación).","Habilidades"
87,2,4,"Inglés","Knows how to use digital tools and technologies in a remote working context for idea generation and co-creation of digital content (e.g. shared mind maps and whiteboards, polling tools).","Skills"
88,2,4,"Español","Sabe evaluar las ventajas e inconvenientes de las aplicaciones digitales para hacer efectiva la colaboración (por ejemplo, el uso de espacios en línea para la cocreación, herramientas de gestión de proyectos compartidos).","Habilidades"
88,2,4,"Inglés","Knows how to evaluate the advantages and disadvantages of digital applications for making collaboration effective (e.g. the use of online spaces for co-creation, shared project management tools).","Skills"
89,2,4,"Español","Anima a todos a expresar sus propias opiniones de forma constructiva al colaborar en entornos digitales.","Actitudes"
89,2,4,"Inglés","Encourages everyone to express their own opinions constructively when collaborating in digital environments.","Attitudes"
90,2,4,"Español","Actúa con confianza para lograr los objetivos del grupo cuando participa en la coconstrucción de recursos o conocimientos.","Actitudes"
90,2,4,"Inglés","Acts in trustworthy ways to achieve group goals when engaging in co-construction of resources or knowledge.","Attitudes"
91,2,4,"Español","Tiende al uso de herramientas digitales adecuadas para fomentar la colaboración entre los miembros de un equipo y, al mismo tiempo, garantizar la accesibilidad digital.","Actitudes"
91,2,4,"Inglés","Inclined to use appropriate digital tools for fostering collaboration between the members of a team while, at the same time, ensuring digital accessibility.","Attitudes"
92,2,5,"Español","Conoce el significado de los mensajes no verbales (por ejemplo, caritas sonrientes, emoticonos) que se utilizan en los entornos digitales (por ejemplo, redes sociales, mensajería instantánea) y saber que su uso puede variar culturalmente entre países y comunidades.","Conocimiento"
92,2,5,"Inglés","Aware of the meaning of non-verbal messages (e.g. smiley faces, emojis) used in digital environments (e.g. social media, instant messaging) and knowing that their use can culturally differ between countries and communities.","Knowledge"
93,2,5,"Español","Es consciente de la existencia de algunas normas esperadas sobre el propio comportamiento cuando se utilizan las tecnologías digitales (por ejemplo, utilizar auriculares de audio en lugar de altavoces cuando se atienden llamadas en lugares públicos o se escucha música).","Conocimiento"
93,2,5,"Inglés","Aware of the existence of some expected rules about one’s behaviour when using digital technologies (e.g. using audio headsets instead of loudspeakers when taking calls in public places or listening to music).","Knowledge"
94,2,5,"Español","Comprende que los comportamientos inadecuados en entornos digitales (por ejemplo, la embriaguez, el exceso de intimidad y otros comportamientos sexualmente explícitos) pueden perjudicar a largo plazo los aspectos sociales y personales de la vida.","Conocimiento"
94,2,5,"Inglés","Understands that inappropriate behaviours in digital environments (e.g. drunken, being overly intimate and other sexually explicit behaviour) can damage social and personal aspects of lives over a long term.","Knowledge"
95,2,5,"Español","Es consciente de que la adaptación del propio comportamiento en los entornos digitales depende de la relación con otros participantes (por ejemplo, amigos, compañeros de trabajo, directivos) y de la finalidad de la comunicación (por ejemplo, instruir, informar, persuadir, ordenar, entretener, indagar, socializar).","Conocimiento"
95,2,5,"Inglés","Aware that adapting one’s behaviour in digital environments depends on one’s relationship with other participants (e.g. friends, co-workers, managers) and the purpose in which the communication takes place (e.g. to instruct, inform, persuade, order, entertain, inquire, socialise).","Knowledge"
96,2,5,"Español","Es consciente de los requisitos de accesibilidad cuando se comunica en entornos digitales, de modo que la comunicación sea inclusiva y accesible para todos las personas (por ejemplo, para las personas con discapacidad, las personas mayores, las personas con bajo nivel de alfabetización, los hablantes de otro idioma).","Conocimiento"
96,2,5,"Inglés","Aware of accessibility requirements when communicating in digital environments so that communication is inclusive and accessible for all users (e.g. for people with disabilities, older people, those with low literacy, speakers of another language).","Knowledge"
97,2,5,"Español","Sabe cómo dejar de recibir mensajes o correos electrónicos molestos no deseados.","Habilidades"
97,2,5,"Inglés","Knows how to stop receiving unwanted disturbing messages or emails.","Skills"
98,2,5,"Español","Es capaz de gestionar los propios sentimientos cuando se habla con otras personas en Internet.","Habilidades"
98,2,5,"Inglés","Able to manage one’s feelings when talking with other people on the internet.","Skills"
99,2,5,"Español","Sabe reconocer los mensajes o actividades hostiles o despectivas en línea que atacan a determinadas personas o grupos de personas (por ejemplo, la incitación al odio).","Habilidades"
99,2,5,"Inglés","Knows how to recognise hostile or derogatory messages or activities online that attack certain individuals or groups of individuals (e.g. hate speech).","Skills"
100,2,5,"Español","Puede gestionar interacciones y conversaciones en diferentes contextos socioculturales y situaciones específicas del ámbito.","Habilidades"
100,2,5,"Inglés","Can manage interactions and conversations in different socio-cultural contexts and domain-specific situations.","Skills"
101,2,5,"Español","Cree que es necesario definir y compartir las normas dentro de las comunidades digitales (por ejemplo, explicar los códigos de conducta para crear, compartir o publicar contenidos).","Actitudes"
