"ID_ejemplo","ID_area","ID_competencia","Idioma","Texto","Tipo"
202,4,3,"Español","Desconfía de la fiabilidad de las recomendaciones (por ejemplo, si son de una fuente reputada) y de sus intenciones (por ejemplo, si realmente ayudan o le animan a utilizar más el dispositivo para exponerse a la publicidad).","Actitudes"
202,4,3,"Inglés","Wary of the reliability of recommendations (e.g. are they by a reputable source) and their intentions (e.g. do they really help the user vs encourage to use the device more to be exposed to advertising).","Attitudes"
203,4,4,"Español","Es consciente del impacto medioambiental de las prácticas digitales cotidianas (por ejemplo, la transmisión de vídeo que depende de la transferencia de datos), y de que el impacto se compone del uso de energía y las emisiones de carbono de los dispositivos, la infraestructura de red y los centros de datos.","Conocimiento"
203,4,4,"Inglés","Aware of the environmental impact of everyday digital practices (e.g. video streaming that rely on data transfer), and that the impact is composed of energy use and carbon emissions from devices, network infrastructure and data centres.","Knowledge"
204,4,4,"Español","Es consciente del impacto medioambiental de la fabricación de dispositivos digitales y baterías (por ejemplo, contaminación y subproductos tóxicos, consumo de energía) y de que, al final de su vida útil, estos dispositivos deben eliminarse adecuadamente para minimizar su impacto medioambiental y permitir la reutilización de componentes raros y caros y de recursos naturales.","Conocimiento"
204,4,4,"Inglés","Aware of the environmental impact of the manufacturing of digital devices and batteries (e.g. pollution and toxic by-products, consumption of energy) and that at the end of their life, such devices must be appropriately disposed of to minimise their environmental impact and to enable reuse of rare and expensive components and natural resources.","Knowledge"
205,4,4,"Español","Es consciente de que algunos componentes de los dispositivos electrónicos y digitales pueden ser sustituidos para prolongar su vida útil o su rendimiento, sin embargo, algunos pueden estar diseñados a propósito para dejar de funcionar correctamente después de un cierto período (obsolescencia planificada).","Conocimiento"
205,4,4,"Inglés","Aware that some components of electronic and digital devices can be replaced to extend their life or performance, however, some might be purposefully designed to stop functioning correctly after a certain period (planned obsolescence).","Knowledge"
206,4,4,"Español","Conoce los comportamientos “verdes” que hay que seguir al comprar dispositivos digitales, por ejemplo, elegir productos con menos consumo de energía durante el uso y en espera, menos contaminantes (productos más fáciles de desmontar y reciclar) y menos tóxicos (uso limitado de sustancias perjudiciales para el medio ambiente y la salud).","Conocimiento"
206,4,4,"Inglés","Knows ‘green’ behaviours to follow when buying digital devices, e.g. choose products with less energy consumption during use and stand-by, less polluting (products easier to dismantle and recycle) and less toxic (limited use of substances harmful to the environment and health).","Knowledge"
207,4,4,"Español","Sabe que las prácticas de comercio electrónico, como la compra y la entrega de bienes físicos, tienen un impacto en el medio ambiente (por ejemplo, la huella de carbono del transporte o la generación de residuos).","Conocimiento"
207,4,4,"Inglés","Knows that e-commerce practices such as purchasing and delivery of physical goods have an impact on the environment (e.g. carbon footprint of transport, generation of waste).","Knowledge"
208,4,4,"Español","Es consciente de que las tecnologías digitales (incluidas las impulsadas por la IA) pueden contribuir a la eficiencia energética, por ejemplo, mediante el control de la necesidad de calefacción en el hogar y la optimización de su gestión.","Conocimiento"
208,4,4,"Inglés","Aware that digital technologies (including AI-driven ones) can contribute to energy efficiency, for example through monitoring the need for heating at home and optimising its management.","Knowledge"
209,4,4,"Español","Es consciente de que ciertas actividades (por ejemplo, el entrenamiento de la IA y la producción de criptomonedas como Bitcoin) son procesos que requieren muchos recursos en términos de datos y potencia de cálculo. Por lo tanto, el consumo de energía puede ser elevado, lo que también puede tener un alto impacto medioambiental.","Conocimiento"
209,4,4,"Inglés","Aware that certain activities (e.g. training AI and producing cryptocurrencies like Bitcoin) are resource intensive processes in terms of data and computing power. Therefore, energy consumption can be high which can also have a high environmental impact.","Knowledge"
210,4,4,"Español","Sabe aplicar estrategias eficientes de baja tecnología para proteger el medio ambiente, por ejemplo, apagar los dispositivos y desconectar la Wi-fi, no imprimir documentos, reparar y sustituir componentes para evitar la sustitución innecesaria de dispositivos digitales.","Habilidades"
210,4,4,"Inglés","Knows how to apply efficient low-tech strategies for protecting the environment, e.g. shutting down devices and switching off Wi-fi, not printing out documents, repair and replace component to avoid the unnecessary replacement of digital devices.","Skills"
211,4,4,"Español","Sabe cómo reducir el consumo de energía de los dispositivos y servicios que utiliza, por ejemplo, cambiando los ajustes de calidad de los servicios de transmisión de vídeo, utilizando la conexión Wi-fi en lugar de la de datos cuando está en casa, cerrando las aplicaciones, optimizando los archivos adjuntos del correo electrónico).","Habilidades"
211,4,4,"Inglés","Knows how to reduce the energy consumption of devices and services used, e.g. change the quality settings of video streaming services, using Wi-fi rather than data connectivity when at home, closing apps, optimising email attachments).","Skills"
212,4,4,"Español","Sabe cómo utilizar las herramientas digitales para mejorar el impacto medioambiental y social de su comportamiento de consumo (por ejemplo, buscando productos locales, buscando ofertas colectivas y opciones de transporte compartido).","Habilidades"
212,4,4,"Inglés","Knows how to use digital tools to improve the environmental and social impact of one’s consumer behaviour (e.g. by looking for local produce, by searching for collective deals and car-pooling options for transportation).","Skills"
213,4,4,"Español","Busca formas en las que las tecnologías digitales puedan ayudar a vivir y consumir de una manera que respete la sostenibilidad de la sociedad humana y el entorno natural.","Actitudes"
213,4,4,"Inglés","Seeks out ways in which digital technologies could help live and consume in a way which respects the sustainability of human society and the natural environment.","Attitudes"
214,4,4,"Español","Busca información sobre el impacto medioambiental de la tecnología para influir en su comportamiento y en el de otros (por ejemplo, amigos y familiares) para ser más ecorresponsables en sus prácticas digitales.","Actitudes"
214,4,4,"Inglés","Seeks out information regarding the environmental impact of technology to influence one’s behaviour and that of others (e.g. friends and family) to be more eco-responsible in their digital practices.","Attitudes"
215,4,4,"Español","Considera el impacto global del producto en el planeta cuando elige medios digitales en lugar de productos físicos,por ejemplo, la lectura de un libro en línea no necesita papel y, en consecuencia, los costes de transporte son bajos, perohay que tener en cuenta que los dispositivos digitales incluyen el componente tóxico y la energía necesaria para su carga.","Actitudes"
215,4,4,"Inglés","Considers product’s overall impact on the planet when choosing digital means over physical products, e.g. reading a book online does not need paper and thus transport costs are low, however, one should consider digital devices including toxic component and needed energy to be charged.","Attitudes"
216,4,4,"Español","Considera las consecuencias éticas de los sistemas de IA a lo largo de su ciclo de vida: incluyen tantoel impacto medioambiental (consecuencias medioambientales de la producción de dispositivos y servicios digitales) y el impacto social, por ejemplo, la plataformización del trabajo y la gestión algorítmica que puede reprimir la privacidad o los derechos de los trabajadores; el uso de mano de obra de bajo coste para etiquetar imágenes para entrenar sistemas de IA.","Actitudes"
216,4,4,"Inglés","Considers the ethical consequences of AI systems throughout their life-cycle: they include both the environmental impact (environmental consequences of the production of digital devices and services) and societal impact, e.g. platformisation of work and algorithmic management that may repress workers’ privacy or rights; the use of low-cost labour for labelling images to train AI systems.","Attitudes"
217,5,1,"Español","Conoce las principales funciones de los dispositivos digitales más comunes (por ejemplo, ordenador, tableta, teléfono inteligente).","Conocimiento"
217,5,1,"Inglés","Knows the main functions of the most common digital devices (e.g. computer, tablet, smartphone).","Knowledge"
218,5,1,"Español","Conoce algunas razones por las que un dispositivo digital puede no conectarse en línea (por ejemplo, contraseña Wi-fi incorrecta, modo avión activado).","Conocimiento"
218,5,1,"Inglés","Knows some reasons why a digital device may fail to connect online (e.g. wrong Wi-fi password, airplane mode on).","Knowledge"
219,5,1,"Español","Sabe que la potencia de cálculo o la capacidad de almacenamiento pueden mejorarse para superar la rápida obsolescencia del hardware (por ejemplo, contratando la potencia o el almacenamiento como servicio).","Conocimiento"
219,5,1,"Inglés","Knows that computing power or storage capacity can be improved to overcome fast obsolescence of hardware (e.g. by contracting power or storage as a service).","Knowledge"
220,5,1,"Español","Es consciente de que las fuentes más frecuentes de problemas en el Internet de las Cosas (IdC) y los dispositivos móviles, y en sus aplicaciones, están relacionados con la conectividad/ disponibilidad de la red, la batería/energía, la potencia de procesamiento limitada.","Conocimiento"
220,5,1,"Inglés","Aware that the most frequent sources of problems in Internet of Thing (IoT) and mobile devices, and in their applications, are related to connectivity/network availability, battery/power, limited processing power.","Knowledge"
221,5,1,"Español","Es consciente de que la IA es un producto de la inteligencia y la toma de decisiones humanas (es decir, los humanos eligen, limpian y codifican los datos, diseñan los algoritmos, entrenan los modelos y curan y aplican los valores humanos a los resultados) y, por tanto, no existe independientemente de los humanos.","Conocimiento"
221,5,1,"Inglés","Aware that AI is a product of human intelligence and decision-making (i.e. humans choose, clean and encode the data, they design the algorithms, train the models, and curate and apply human values to the outputs) and therefore does not exist independently of humans.","Knowledge"
222,5,1,"Español","Sabe cómo identificar y resolver un problema de cámara y/o de micrófono en una reunión en línea.","Habilidades"
222,5,1,"Inglés","Knows how to identify and solve a camera and/or a microphone issue when in an online meeting.","Skills"
223,5,1,"Español","Sabe cómo verificar y solucionar problemas relacionados con los dispositivos IdC interconectados y sus servicios.","Habilidades"
223,5,1,"Inglés","Knows how to verify and troubleshoot problems related to interconnected IoT devices and their services.","Skills"
224,5,1,"Español","Adopta un enfoque paso a paso para identificar la raíz de un problema técnico (por ejemplo, hardware frente a software) y explora varias soluciones cuando se enfrenta a un mal funcionamiento técnico.","Habilidades"
224,5,1,"Inglés","Takes a step-by-step approach to identify the root of a technical problem (e.g. hardware vs software) and explores various solutions when facing a technical malfunction.","Skills"
225,5,1,"Español","Sabe encontrar soluciones en Internet cuando se enfrenta a un problema técnico","Habilidades"
225,5,1,"Inglés","Knows how to find solutions on the internet when facing a technical problem","Skills"
226,5,1,"Español","Adopta un enfoque activo y basado en la curiosidad para explorar el funcionamiento de las tecnologías digitales.","Actitudes"
226,5,1,"Inglés","Takes an active and curiosity driven approach to explore how digital technologies operate.","Attitudes"
227,5,2,"Español","Sabe que es posible comprar y vender bienes y servicios en Internet a través de transacciones comerciales (por ejemplo, el comercio electrónico) y de consumidor a consumidor (por ejemplo, las plataformas de intercambio). Al comprar en línea a una empresa se aplican normas diferentes (por ejemplo, la protección legal del consumidor) que a un particular.","Conocimiento"
227,5,2,"Inglés","Knows that it is possible to buy and sell goods and services on the internet through commercial transactions (e.g. e-commerce) and consumer-to-consumer transactions (e.g. sharing platforms). Different rules (e.g. legal consumer protections) apply when buying online from a company than from a private person.","Knowledge"
228,5,2,"Español","Es capaz de identificar algunos ejemplos de sistemas de IA: recomendadores de productos (por ejemplo, en sitios de compras en línea), reconocimiento de voz (por ejemplo, por parte de asistentes virtuales), reconocimiento de imágenes (por ejemplo, para detectar tumores en radiografías) y reconocimiento facial (por ejemplo, en sistemas de vigilancia).","Conocimiento"
228,5,2,"Inglés","Able to identify some examples of AI systems: product recommenders (e.g. on online shopping sites), voice recognition (e.g. by virtual assistants), image recognition (e.g. for detecting tumours in x-rays) and facial recognition (e.g. in surveillance systems).","Knowledge"
229,5,2,"Español","Es consciente de que muchos artefactos no digitales pueden crearse con una impresora 3D (por ejemplo, para imprimir piezas de recambio de electrodomésticos o muebles).","Conocimiento"
229,5,2,"Inglés","Aware that many non-digital artefacts can be created using 3D printer (e.g. to print spare parts for domestic appliances or furniture.","Knowledge"
230,5,2,"Español","Conoce los enfoques técnicos que pueden mejorar la inclusividad y la accesibilidad de los contenidos y servicios digitales, por ejemplo, herramientas como la ampliación o el zoom y la funcionalidad de conversión de texto a voz.","Conocimiento"
230,5,2,"Inglés","Knows technical approaches that can improve the inclusiveness and accessibility of digital content and services, e.g. tools such as magnification or zoom and text-to-voice functionality.","Knowledge"
231,5,2,"Español","Es consciente de que la tecnología basada en el habla impulsada por la IA permite el uso de comandos hablados que pueden mejorar la accesibilidad de las herramientas y dispositivos digitales (por ejemplo, para las personas con movilidad o visuales limitaciones, cognición limitada, dificultades lingüísticas o de aprendizaje), sin embargo, las lenguas habladas por poblaciones más pequeñas a menudo no están disponibles, o funcionan peor, debido a la priorización comercial.","Conocimiento"
231,5,2,"Inglés","Aware that AI-driven speech-based technology enables the use of spoken commands that can enhance the accessibility of digital tools and devices (e.g. for those with mobility or visual limitations, limited cognition, language or learning difficulties), however, languages spoken by smaller populations are often not available, or perform worse, due to commercial prioritisation.","Knowledge"
232,5,2,"Español","Sabe utilizar Internet para realizar transacciones (por ejemplo, compra, venta) y no comerciales (por ejemplo, donaciones, regalos) de bienes y servicios de todo tipo.","Habilidades"
232,5,2,"Inglés","Knows how to use the internet to conduct transactions (e.g. purchasing, selling) and non-commercial ones (e.g. donating, gifting) of goods and services of all kinds.","Skills"
233,5,2,"Español","Sabe cómo y cuándo utilizar soluciones de traducción automática (por ejemplo, Google Translate, DeepL) y aplicaciones de interpretación simultánea (por ejemplo, iTranslate) para obtener una comprensión aproximada de un documento o una conversación. Sin embargo, también sabe que cuando el contenido requiere una traducción precisa (por ejemplo, en la sanidad, el comercio o la diplomacia), puede ser necesaria una traducción más precisa.","Habilidades"
233,5,2,"Inglés","Knows how and when to use machine translation solutions (e.g. Google Translate, DeepL) and simultaneous interpretation apps (e.g. iTranslate) to get a rough understanding of a document or conversation. However, also knows that when the content requires an accurate translation (e.g. in healthcare, commerce or diplomacy), a more precise translation may be needed.","Skills"
234,5,2,"Español","Sabe elegir herramientas de asistencia para acceder mejor a la información y los contenidos en línea (por ejemplo, lectores de pantalla, herramientas de reconocimiento de voz), y aprovechar las opciones de salida de voz para producir discurso (por ejemplo, para que lo utilicen las personas que tienen medios limitados o nulos para comunicarse oralmente).","Habilidades"
234,5,2,"Inglés","Knows how to choose assistive tools to better access information and content online (e.g. screen readers, voice recognition tools), and to take advantage of voice output options to produce speech (e.g. to be used by individuals who have limited or no means to communicate orally).","Skills"
235,5,2,"Español","Valora los beneficios de la gestión de las finanzas y las transacciones financieras a través de medios digitales, al tiempo que reconoce los riesgos asociados.","Actitudes"
235,5,2,"Inglés","Values the benefits of managing finances and financial transactions through digital means while acknowledging the associated risks.","Attitudes"
236,5,2,"Español","Se abre a explorar y detectar las oportunidades creadas por las tecnologías digitales para las necesidades personales (por ejemplo, buscar audífonos que se emparejen con los dispositivos más utilizados, como el teléfono, la televisión, la cámara o la alarma de incendios). Es consciente de que la dependencia exclusiva de las tecnologías digitales también puede entrañar riesgos.","Actitudes"
236,5,2,"Inglés","Open to explore and spot opportunities created by digital technologies for one´s personal needs (e.g. seeking hearing aids that pair with one’s most-used devices, such as phone, TV, camera, smoke-alarm). Critically aware that exclusive reliance on digital technologies can pose risks too.","Attitudes"
237,5,3,"Español","Sabe que participar en la resolución de problemas en colaboración, en línea o fuera de la pantalla, significa que se puede aprovechar la variedad de conocimientos, perspectivas y experiencias de los demás, lo que puede conducir a mejores resultados.","Conocimiento"
237,5,3,"Inglés","Knows that engaging in solving problems collaboratively, online or off-screen, means that one can take advantage of the variety of knowledge, perspectives and experiences from others which can lead to better outcomes.","Knowledge"
238,5,3,"Español","Sabe que las tecnologías digitales y los dispositivos electrónicos pueden utilizarse como herramienta para apoyar la innovación de nuevos procesos y productos, con el fin de crear valor social, cultural y/o económico (por ejemplo, social, innovación). Es consciente de que lo que crea valor económico puede poner en peligro o aumentar el valor social o cultural.","Conocimiento"
238,5,3,"Inglés","Knows that digital technologies and electronic devices can be used as a tool to support the innovation of new processes and products, in order to create social, cultural and/or economic value (e.g. social innovation). Aware that what creates economic value might endanger or enhance social or cultural value.","Knowledge"
239,5,3,"Español","Sabe que las aplicaciones de la tecnología del Internet de las Cosas (IdC) tienen el potencial de ser utilizadas en muchos sectores diferentes (por ejemplo, la sanidad, la agricultura, la industria, los automóviles, las actividades de ciencia ciudadana).","Conocimiento"
239,5,3,"Inglés","Knows that applications of Internet of Things (IoT) technology have the potential to be used in many different sectors (e.g. healthcare, agriculture, industry, automobiles, citizen science activities).","Knowledge"
240,5,3,"Español","Sabe cómo utilizar las tecnologías digitales para ayudar a convertir su idea en acción (por ejemplo, dominar la realización de vídeos para abrir un canal para compartir recetas y consejos de nutrición para un estilo dietético específico).","Habilidades"
240,5,3,"Inglés","Knows how to use digital technologies to help turn one’s idea into action (e.g. master video making to open a channel to share recipes and nutrition tips for a specific dietary style).","Skills"
241,5,3,"Español","Puede identificar las plataformas en línea que se pueden utilizar para diseñar, desarrollar y probar las tecnologías del IdC y las aplicaciones móviles.","Habilidades"
241,5,3,"Inglés","Can identify online platforms that can be used to design, develop and test IoT technologies and mobile apps.","Skills"
242,5,3,"Español","Sabe planificar una estrategia utilizando múltiples dispositivos IdC y móviles para ejecutar una tarea (por ejemplo, utilizar un teléfono inteligente para optimizar el consumo de energía en una habitación ajustando la intensidad de las luces en función de la hora del día y la luz ambiental).","Habilidades"
242,5,3,"Inglés","Knows how to plan a strategy using multiple IoT and mobile devices to implement a task (e.g. use a smartphone to optimise energy consumption in a room by setting the intensity of the lights based on the time of day and ambient light).","Skills"
243,5,3,"Español","Sabe cómo comprometerse en la resolución de problemas sociales a través de medios digitales, híbridos y soluciones no digitales para el problema (por ejemplo, prever y planificar bancos de tiempo en línea, sistemas de información pública, plataformas para compartir recursos).","Habilidades"
243,5,3,"Inglés","Knows how to engage in resolving social problems through digital, hybrid and non-digital solutions for the problem (e.g. envisioning and planning online time banks, public reporting systems, resource sharing platforms).","Skills"
244,5,3,"Español","Está dispuesto a participar en retos y concursos destinados a resolver problemas intelectuales, sociales o prácticos a través de las tecnologías digitales (por ejemplo, hackathones, ideaciones, becas, iniciación conjunta de proyectos).","Actitudes"
244,5,3,"Inglés","Willing to take part in challenges and contests aimed at solving intellectual, social or practical problems through digital technologies (e.g. hackathons, ideations, grants, joint initiation of projects).","Attitudes"
245,5,3,"Español","Está motivado para codiseñar y cocrear nuevos productos y servicios utilizando dispositivos digitales (es decir, desarrollo para el usuario final) con el fin de crear valor económico o social para otros (por ejemplo, en makerspaces y otros espacios colectivos).","Actitudes"
245,5,3,"Inglés","Motivated to co-design and co-create new products and services using digital devices (i.e. end-user development) to create economic or social value for others (e.g. in makerspaces and other collective spaces).","Attitudes"
246,5,3,"Español","Se abre a participar en procesos de colaboración para codiseñar y cocrear nuevos productos y servicios basados en sistemas de IA para apoyar y mejorar la participación de la ciudadanía en la sociedad.","Actitudes"
246,5,3,"Inglés","Open to engage in collaborative processes to co-design and co-create new products and services based on AI systems to support and enhance citizens’ participation in society.","Attitudes"
247,5,4,"Español","Es consciente de que ser competente digitalmente implica el uso confiado, crítico y responsable de las tecnologías digitales para alcanzar objetivos relacionados con el trabajo, el aprendizaje, el ocio, la inclusión y la participación en la sociedad.","Conocimiento"
247,5,4,"Inglés","Aware that being digitally competent entails the confident, critical and responsible use of digital technologies to achieve goals related to work, learning, leisure, inclusion and participation in society.","Knowledge"
248,5,4,"Español","Es consciente de que las dificultades que se experimentan al interactuar con las tecnologías digitales pueden deberse a cuestiones técnicas, a la falta de confianza, a la propia falta de competencia o a la elección inadecuada de la herramienta digital para resolver el problema en cuestión.","Conocimiento"
248,5,4,"Inglés","Aware that difficulties experienced while interacting with digital technologies may be due to technical issues, lack of confidence, one’s own competence gap or inadequate choice of digital tool to solve the problem in question.","Knowledge"
249,5,4,"Español","Es consciente de que las herramientas digitales pueden utilizarse para ayudar a identificar los propios intereses de aprendizaje y establecer objetivos personales en la vida (por ejemplo, itinerarios de aprendizaje).","Conocimiento"
